{
  "title": {
    "text": "ESWA 재료교체 불량 개선 진행 결과 및 향후 계획",
    "source_ids": [
      "P-ASM-001"
    ]
  },
  "head_message": {
    "text": "재료교체 불량률 개선 효과가 2주 평균 0.139%로 유지되고 있으며, 북미 수평전개(10/13)로 과제를 마무리하겠습니다",
    "source_ids": [
      "D-260928-ljh-01",
      "D-261001-ljh-01"
    ]
  },
  "background_conclusion": [
    {
      "text": "호기·모델별 품질 편차로 수율 손실이 지속되어, 재료교체 구간 Y축 불량을 EPC 보정·예측 보정 로직으로 개선하고 있습니다.",
      "source_ids": [
        "P-ASM-001"
      ]
    },
    {
      "text": "1차 로직 적용으로 E77 불량률이 0.189% → 0.164%로 감소했고, 2차 로직 후 ESWA 2주 평균 0.139%로 효과가 유지되고 있습니다.",
      "source_ids": [
        "P-ASM-001",
        "D-260928-ljh-01"
      ]
    },
    {
      "text": "Normal Line까지 수평전개를 완료해 누적 26대에 적용했으며, 북미는 PLC 펌웨어 검증 후 10/13 적용하겠습니다.",
      "source_ids": [
        "D-260930-khw-01",
        "D-261001-ljh-01"
      ]
    }
  ],
  "emphasis": [
    "0.189% → 0.164%",
    "2주 평균 0.139%",
    "10/13 적용"
  ],
  "left_title": {
    "text": "추진 경과 및 성과",
    "source_ids": [
      "P-ASM-001"
    ]
  },
  "left_items": [
    {
      "text": "[1차 로직] EPC 보정량·이음매 예측 보정 개선 (8/13 적용)",
      "source_ids": [
        "P-ASM-001"
      ]
    },
    {
      "text": "- E77 불량률 0.189% → 0.164%",
      "source_ids": [
        "P-ASM-001"
      ]
    },
    {
      "text": "[2차 로직] Limit ±0.35mm 적용 (9/4~), 대표 4대 0.270% → 0.185%",
      "source_ids": [
        "P-ASM-001"
      ]
    },
    {
      "text": "- ESWA 0.171% → 0.144%(4일) → 0.139%(2주)",
      "source_ids": [
        "D-260922-ljh-01",
        "D-260928-ljh-01"
      ]
    },
    {
      "text": "[수평전개] MEB·ESMI1 #2-2·3(9/16), Normal Line(9/30) 完",
      "source_ids": [
        "P-ASM-001",
        "D-260930-khw-01"
      ]
    },
    {
      "text": "- 누적 적용 26대, ESMI1 0.367% → 0.221%(2주 평균)",
      "source_ids": [
        "D-260928-ljh-01",
        "D-260930-khw-01"
      ]
    }
  ],
  "right_title": {
    "text": "향후 계획 및 요청 사항",
    "source_ids": [
      "P-ASM-001"
    ]
  },
  "right_items": [
    {
      "text": "[북미 수평전개] 10/13 적용 예정, PLC 보정 파라미터 이식 전 검증",
      "source_ids": [
        "D-261001-ljh-01"
      ]
    },
    {
      "text": "[최종 효과 산출] ~10/16 완료, 완료 회고 초안 작성 중",
      "source_ids": [
        "D-261002-ljh-01"
      ]
    },
    {
      "text": "[모니터링] 효과 유지 여부 한두 주 추가 확인",
      "source_ids": [
        "D-260928-ljh-01"
      ]
    },
    {
      "text": "▶ 요청: 북미 PLC 검증용 원격 접속 지원 여부 IT팀 확인",
      "source_ids": [
        "D-261001-ljh-01"
      ]
    }
  ]
}
